{
  "$schema": "../../schemas/lab-environments.schema.json",
  "schemaVersion": "1.0",
  "tenantId": "11111111-1111-4111-8111-111111111111",
  "targetSubscriptionId": "22222222-2222-4222-8222-222222222222",
  "subscriptions": [
    "22222222-2222-4222-8222-222222222222"
  ],
  "solutions": [
    {
      "id": "example-solution",
      "repository": "https://github.com/example/azd-example-solution",
      "desiredEnvironment": "pilot",
      "desiredResourceGroup": "rg-example-pilot",
      "deployableKind": "azure",
      "environments": [
        {
          "name": "pilot",
          "subscriptionId": "22222222-2222-4222-8222-222222222222",
          "resourceGroup": "rg-example-pilot",
          "sourceRevision": null,
          "validationStatus": "unknown",
          "tenantObjectsTracked": false
        }
      ]
    }
  ]
}
